{
  "id": "test3",
  "name": "test3",
  "short_description": "test3",
  "internal_storage_path": "test3",
  "modality": "CT",
  "anatomy": "test3",
  "task": "segmentation",
  "access_level": "internal",
  "created_by": "test3",
  "created_at": "2026-05-08T10:04:14.138Z",
  "updated_at": "2026-05-08T10:04:14.138Z"
}
