{
  "id": "phase3-smoke-01",
  "name": "Phase 3 smoke dataset",
  "short_description": "Temporary row to verify catalogue writes.",
  "internal_storage_path": "/group/proj-data/phase3-smoke-01/",
  "modality": "CT",
  "anatomy": "liver",
  "task": "segmentation",
  "access_level": "internal",
  "created_by": "niels.rocholl",
  "created_at": "2026-05-07T12:00:00Z",
  "updated_at": "2026-05-07T12:00:00Z"
}
